,name,artists,acousticness,danceability,duration_ms,energy,instrumentalness,key,liveness,loudness,mode,speechiness,tempo,time_signature,valence,lyrics,annotations,nlp_lyrics,nlp_annotations,valence+nlp,mood
The Women are led away by Paramedics.  Haley cocks his head
questioningly at Gordon as they proceed into the alley.

GORDON
Forget it.  That airhead from the
subway could never have made it to
the north side of town this fast.

HALEY
Maybe there's more than one of them.
Maybe we're dealing with some sort
of secret society of cross-dressers.

Wells is led past them, still groggy, as they arrive at the open
manhole and peer down into the forbidding blackness.

GORDON
Get after him, Haley.

HALEY
(gulping)
Me, Sir?

GORDON
Well, you're the only one with an
accurate description!

Haley reluctantly lowers himself into the open manhole as Gordon turns,
yells down the alleyway.

GORDON (CONT'D)
Comb the area!  I want every squad
car available!  We're looking for
the mother of all psychos in a party
costume!

Gordon turns back, looks down into the empty manhole where Haley has
now disappeared.

HALEY'S VOICE
(from manhole)
You don't think he...bites, do you,
Sir?

EXT. GOTHAM APARTMENT HOUSE - HIGH SHOT - NIGHT

CAMERA LOOKS DOWN from the roof of a Gotham skyscraper at the windows
of a forty-story apartment house below.

CAMERA HOLDS on a pair of glass doors leading out to a rosetta-carved
stone balcony.  Clearly visible through the doors:  AN ELDERLY COUPLE
lie face down on the floor of their living room, guarded by a masked
BURGLAR holding a shotgun.  ANOTHER BURGLAR has managed to open a wall
safe and begins stuffing valuables into a gunny sack.

CAMERA ZOOMS BACK!

We are some thirty stories higher across a wide avenue.

A black-gloved hand ENTERS FRAME, holding a thin, clear nylon cord with
a tiny barbed fishhook on the end.

The other gloved hand steadies a gleaming titanium rifle barrel with an
infrared scope.  The fishhook is threaded through the chamber.

A flap is opened in a thick, compartmentalized black belt.  The
moonlight glints off a cylindrical silver gas cartridge.

ANGLE ACROSS STREET THROUGH SCOPE

Seen through the magnified infrared scope:  the cross hairs of the
rifle sight settle in on the head of the Burglar holding the shotgun.

The cross hairs pause - then suddenly lower to the balcony.  The rifle
FIRES with an audible ""hiss"" of compressed gas.

ANGLE ON ROSETTA BALCONY

As the fishhook whistles through a hole in the rosetta stone framework
of the balcony.  On impact with the floor it pops open - expanding to
ten times its size, having now become an effective grappling hook.

INT. APARTMENT - NIGHT

The Burglar with the shotgun turns at the muffled metallic NOISE, looks
through the glass doors at the empty balcony.

EXT. BALCONY FLOOR

The grappling hook inches across the balcony floor, catching a firm
hold against the stone.

EXT. SKYSCRAPER ROOF - NIGHT

The nylon cord has been pulled taut - it disappears down into the
blackness at a dizzying height, some four hundred feet above the avenue
and crisscrossing traffic lights below.

Black-gloved hands take hold of the cord, testing it.

EXT. SKY - NIGHT

An ominous BLACK SHADOW, cape billowing out behind in an eerie
silhouette, passes in front of the glowing yellow ball of the full
moon.

ANGLE DOWN CORD AT BALCONY

The balcony and double glass doors WHISTLE UP AT CAMERA at a dizzying
speed, growing larger by the millisecond!

INT. APARTMENT - NIGHT

The Burglar has finished his work at the safe.  He nods to the other
Burglar who grins, then cocks his shotgun, pointing it down at the
helpless Couple on the floor.

The flicker of an outside SHADOW flits across the room - the Burglar
blinks, wheels with his shotgun!

Suddenly:  the double doors explode with a hail of shattering glass!
Almost simultaneously - the shotgun FIRES!

INT. GORDON'S CAR - NIGHT

A surly Gordon looks over as his intercom crackles.

INTERCOM VOICE
Commissioner, this is Sergeant
Havemeyer.  I'm on the fortieth
floor of the Gotham Arms.  Our boy
has struck again.  Cape, boots, hood
-- the whole drill.

GORDON
(snatches intercom)
When?

HAVEMEYER'S VOICE
Just now.  The owners tripped a
silent alarm.  We responded and
heard a gunshot as we were running
down the hallway.  The victims are
fine.  Sonofabitch cold-cocked both
perpetrators.

GORDON
Atta boy, Havemeyer.  Hold him for
questioning till I get there.

HAVEMEYER'S VOICE
Can't do that, Sir.  He's...already
left.

GORDON
But you were right outside the door...

HAVEMEYER'S VOICE
He left...by the window, Sir.

GORDON
By the window?  Goddamnit, Man,
you're on the fortieth floor!

HAVEMEYER'S VOICE
That's...affirmative, Sir.

GORDON
You get back to headquarters pronto,
Mister!  I want your urine checked
for drugs!

HAVEMEYER'S VOICE
Yes, Sir.

Gordon slams down the intercom in disgust.

GORDON
Maybe it's something in the water.
Maybe the whole city's on drugs.

EXT. GOTHAM STREETS - NIGHT

Police SIRENS everywhere.  A squad car rolls slowly down the street,
its spotlight searching the doorways and alleys.

INT. SQUAD CAR - NIGHT

The COP DRIVER yawns, turns to his PARTNER who works the spotlight, now
notices something.

COP DRIVER
What's that?

PARTNER
Wino...
(out the window)
Go back to sleep, Ace!

Suddenly:  A WHISTLING SOUND through the air!  The two Cops blink, snap
their heads forward as the searchlight is trained on:

ANGLE ON BATMAN - THEIR  P.O.V.

THE BATMAN! - Seen in his majestic totality for the very first time.  A
truly awesome figure from his black cowl to his gleaming black boots.
His huge, dark cape billows out ominously behind him.

BACK TO SQUAD CAR

COP DRIVER
Holee shit...

PARTNER
Let's get him!

BACK TO SCENE

The squad car lurches forward!  Batman whirls, runs down an alley.  The
squad car swings, pulls in after him.

INT. ALLEY - NIGHT

Batman runs with the speed of an Olympic sprinter, but the squad car
gains rapidly.  He looks over his shoulder.

ANGLE ON SQUAD CAR - HIS P.O.V.

The squad car fills the alleyway.

BACK TO BATMAN

He looks in front of him in horror - another squad car speed at him
from the other direction.  It too fills the alleyway.  There's no place
to hide.

ANGLE ON SQUAD CAR #1

Filling frame - the Cops grinning.

ANGLE ON SQUAD CAR #2

Filling frame - the Cops grinning.

BACK TO BATMAN

He stands his ground.  Then - curiously - runs directly at the first
squad car.

ANGLE THROUGH WINDSHIELD - SQUAD CAR #1

COP #1
What the...?

BACK TO BATMAN - SLOW MOTION SHOT

With a perfectly timed leap, Batman vaults onto the hood of the car in
a somersault and does a complete 360 - up the windshield - over the
roof - off the trunk - lands on the pavement with the grave of a cat.

ANGLE ON TWO POLICE CARS

They crash head-on with a sickening sound of crunching metal and flying
glass.  Two groggy Police exit, front doors falling off, try to clear
their heads.

EXT. WAYNE MANOR - DAWN

The first orange rays of the morning sun stab upwards through the
clouds over Wayne Manor.

INT. YOUNG BRUCE'S LAB - DAY

Young Bruce Wayne's lab room remains much as we remember it, except
that the gaping hole in the wall caused by the laser has been
reinforced and shaped into a doorway.  A make-shift ladder-like
stairway leads down into the cavern below.

FOOTSTEPS are heard climbing the ladder from deep within the cave.
After a moment, Bruce appears, stripped to the waist, still wearing his
utility belt and the bottom half of his Batman suit.  His chest and
stomach are nicked with small cuts and bruises from his previous
night's work.  His forehead glistens with sweat born of utter
exhaustion.  He sits heavily on a cot, buries his face in his hands,
looks up suddenly as the door to the lab opens.

Alfred enters, stares silently, first appalled by Bruce's physical
condition, then shaking his head with sympathy.  Bruce stares back,
eyes heavy with lack of sleep.

BRUCE
You...think I'm crazy, don't you?
Certifiably insane.

ALFRED
(pause; smile)
A bit...eccentric, perhaps.

BRUCE
It's...what I have to do, Alfred.
After all those years of searching
-- it was always what I had to do.

ALFRED
If I may be permitted, Sir...
(with difficulty)
I've...never had any children of my
own.  Never saw the advantage in it,
considering my profession.  I've
always thought myself more talented
at raising flowers than people...

Bruce looks up with a warm smile of gratitude.

ALFRED
Oh, I didn't raise you, Sir, I
simply watched you grow.

INSERT SHOT - GOTHAM TRIBUNE

A Banner edition of the Gotham Tribune cartwheels INTO FRAME:  On the
front page:  fanciful artist's renditions drawn from eyewitness
recollections of the Batman.

One is of a menacing black vampire with long, pointed fangs.  Another
show a dark, furry giant with huge feathered wings.  Above them the
headline:  BAT-MAN INVADES CITY.  MASS HYSTERIA GRIPS GOTHAM.  POLICE
NO MATCH FOR WINGED INTRUDER.

CAMER HOLDS on the newspaper as we hear the jumbled and excited VOICES
of REPORTERS underneath:

REPORTER'S VOICE
Commissioner, how do you explain this
Fantastic phenomenon?

GORDON'S VOICE
I can't explain it.  I only hope for the
poor fellow's sake, he's sobered up by now.

EXT. GOTHAM COUNTRY CLUB - DAY

Bruce lies on a deck chair by the swimming pool of the Gotham Country
Club, his body coated with sun oil.  He listens to Gordon's TV press
conference on a tiny transistor set next to him.  His eyes flutter open
with amusement.

TV REPORTER
Well considering the fact he apprehended
four criminals last night, shouldn't we
be calling him...a good Samaritan?

GORDON
Sure.  If you feel like calling John
Hinkley a political activist.

Bruce's eyes suddenly bulge wider.  He gazes across the swimming pool,
transfixed by what he sees.

ANGLE ON SILVER - BRUCE'S P.O.V.

A stunning-looking woman (SILVER ST. CLOUD) steps out onto the high
board of the pool, dressed in a daringly-cut shiny white latex tank
suit.  A shining mane of glistening silver hair cascades down across
her shoulders.  She pauses, a shimmering white diamond in the sun.

REPORTER'S VOICE
Commissioner, it might surprise you
to know that several polls taken
today show more than eighty percent
of those interviewed approve of
this...vigilante and what he did...

Silver glances over in Bruce's direction.  Curiously enough, she seems
to smile at him and wave.

GORDON'S VOICE
Well I can't account for public
taste, bit I'd like to warn any
potential copy cats who may be out
there that...

BACK TO BRUCE

Bruce is stunned and confused, but starts to lift his hand to wave back
when:

THORNE'S VOICE
If brains were bodies, she'd look
just the same.  Can you believe it?

Bruce swivels, lowering his hand.  Thorne stands behind him, waves back
at Silver who executes a complicated but perfect dive into the pool.
She starts to swim across in their direction as Throne grins down at
Bruce.

THORNE
Name's Silver St. Cloud.  Phi Beta
Kappa, Masters Degree in Political
Science.  Just arrived in Gotham to
finish her doctorate on municipal
government and guess which City
councilman drew her as an intern?

BRUCE
(staring)
Taught her much so far?

THORNE
(chuckle)
Not as much as I plan to.

Silver reaches the edge of the pool.  Thorne starts to help her out as
Bruce continues to start.

SILVER
The water's glorious, Rupert.  Come
on in.

THORNE
Never had time to learn how to swim.
Too busy trying to make a living, I
guess.  Not like Mr. Wayne over
here...
(chuckle)
Right, Bruce?
(turns)
Silver St. Cloud - Bruce Wayne.

Bruce looks up, totally mesmerized by the sight of her.  She gazes down
with a devastating smile, the sun sparkling off the beads of water on
her face.  She is instantly and equally smitten as they lock eyes.

SILVER
Please don't get up.

BRUCE
(lost)
Hmm?

SILVER
I said - please don't get up.

BRUCE
Oh.
(starts to get up)
Sorry...

SILVER
That's all right.  I asked you not
to, remember?

BRUCE
(stops)
So you did.  Thanks.

SILVER
Don't mention it.

Rupert watches them watching each other.  The uncomfortable silence is
filled by Gordon's VOICE from the television.

GORDON'S VOICE
And now, if there are no other ques-
tions, it's my birthday tonight and
I have a formal party to get ready
for...

Thorne reaches down, turns off the TV in disgust.

THORNE
That clown has been a disgrace to
law enforcement his entire career.
This city's going to hell in a hand-
basket and some imbecile's giving
him a formal birthday party.

BRUCE
It should be fun.  I'm giving it.

Thorne raises his eyebrows.  Silver still stares.

BRUCE (CONT'D)
Perhaps the two of you would like to
come?

THORNE
SILVER
I'm busy, thanks.									   I'd
love to.

THORNE
(irritated)
Silver, I don't think...ah...

SILVER
If I'm not being too inquisitive,
Mr. Wayne - exactly what is it you
do?

BRUCE
Do?

SILVER
For a living?

THORNE
(chuckles)
You're looking at it.

BRUCE
Actually, Rupert's not being
entirely fair about his...
(nice smile)
Sometimes I go hang gliding.

SILVER
And that's it?

BRUCE
Not quite.

SILVER
I didn't think so.

BRUCE
I have a dog as well.

Silver manages a tiny, unsure smile.

BRUCE (CONT'D)
Wayne Manor.  Eight o'clock.  I'll
have my car pick you up.

THORNE
Why don't you take my car, Silver?
In case you want to leave early.

SILVER
I'm very flattered by the dueling
limos, gentlemen, but I can grab a
cab, thanks.
(nods)
Mr. Wayne...

Silver excuses herself.  Both men watch her departure avidly.

THORNE
Gotham City's no place for a beauti-
ful woman to be travelling alone.
I'm holding you personally responsi-
ble for her safety, Wayne.

BRUCE
Don't worry, Rupert.  I'll treat her
just as if I were in love with her
instead of you.

Thorne's eyes narrow.  Bruce smiles ingenuously.

EXT. WAYNE MANOR - NIGHT

Dozens of expensive cars disgorge their passengers in front of stately
Wayne Manor.

INT. WAYNE MANOR LIVING ROOM - NIGHT

A lavish party is in progress.  A DANCE BAND plays off to the side,
under a banner reading ""Happy Birthday to the Finest of Gotham's
Finest.""

Bruce Wayne greets his arriving GUESTS, his neck craning around in vain
for a sight of Silver.

Gordon stands by the bar, downs a double scotch, scowls at GUESTS who
talks animatedly to him while flapping his arms like wings - doing a
crude imitation of the Batman.  The Guest howls with laughter, moves
off as Gordon orders another drink and Bruce joins him with a
sympathetic smile.

BRUCE
They're giving you a pretty hard time
about that Batman, aren't they...

Gordon nods, tosses back his drink angrily.

GORDON
I'd give up half my pension to be
standing face to face with that
caped fruitcake right now.
(looks off; stares)
Now there's a sight to make an old
man's eyes water.

Silver St. Cloud approaches them, threading her way through the
appreciative glances of the Guests, dressed in a sparkling, metallic
evening gown, the light bouncing off it like tiny bursts of shooting
stars.  She reaches Bruce, extends her hand with a warm smile.

SILVER
I hope I'm not too late.

GORDON
In my case, by twenty years.

BRUCE
Silver, St. Cloud - this is David
Gordon, Commissioner of Police.
Miss St. Cloud is picking up the
finer points of the city government from
Councilman Thorne.

SILVER
My ambition is to hold a job as
important as yours one day, Commis-
sioner.

GORDON
Then you and Mr. Thorne already have
much in common.

SILVER
(suddenly)
Would you care to dance, Mr. Wayne?

BRUCE
(locking eyes)
You're as clairvoyant as you are
beautiful, Miss St. Cloud.

EXT. WAYNE MANOR - NIGHT

Now heading into the driveway is a brightly painted version of an old-
time twenties paddy wagon, with two look-alikes of the old KEYSTONE
KOPS riding on top.  They honk a comical horn loudly as laughing
PARKING ATTENDANTS greet them

INT. WAYNE MANOR - ANGLE ON DANCE FLOOR

Bruce and Silver glide smoothly across the floor - a perfect fit.
Bruce looks down curiously.

SILVER
Something wrong?

BRUCE
You're...leading.

SILVER
I asked you, remember?

Alfred arrives, interrupting them.

ALFRED
Excuse me, Sir, but there are some
oddly dressed gentlemen outside with a
singing telegram for the Commissioner.

BRUCE
Ask them to come in, will you,
Alfred?

Bruce makes his way to the bandstand, whispers some instructions to the
BANDLEADER.  A LOUD FANFARE is played.  All conversation stops as the
front door opens.

Now entering Wayne Manor:  the Two Keystone Kops, in their twenties'
costumes with handlebar moustaches.  They dance their way to the center
of the room in a prearranged routine, singing in harmony from Pirates
of Penzance.

KOPS
When a felon's not engaged in his
employment,
Or maturing his felonious little
plans,
His capacity for innocent enjoyment
Is just as great as any honest
man's...
Oh, a policeman's lot is not a happy
one...

The Guests applaud loudly.  Gordon joins Bruce and Silver as the Kops
break into a vaudeville routine.

KOP
Excuse me, Sir.  Have you seen a
policeman around here?

KOP #2
Why no, I haven't.

KOP
(drawing gun)
Good.  Then give me your watch.

Several Guests laugh.  Bruce winces at the bad joke.

KOP #2
But this watch isn't worth anything.
It only has a sentimental value.

KOP
Well give it to me anyway.  I feel
like a good cry.

Gordon laughs loudly as the Kop turns to him.

KOP (CONT'D)
Now, Commissioner, if we could
borrow your watch for a moment...

GORDON
(taking it off)
Sure.  Be careful with it, okay?

The Kop smiles, takes the watch, dangles it from his hand.  Kop #2
silently sidles in behind Bruce and Silver.

KOP
Here's a good one:  what's a police-
man's favorite way to kill time?

GORDON
(grinning)
I'll bite.  What is a policeman's
favorite way to kill time?

The Kop grins, pull his gun - FIRES!  Gordon's watch is smashed to
smithereens.  Kop #2's gun suddenly at the back of Silver's head,
hammer cocked.

KOP #2
Up against the wall, everybody!
Move!!

The Guests scream as six more Kops burst through the front door
carrying automatic weapons.  Bruce, Silver, and Gordon are herded back
against the wall with the others.

The KOP grins, then suddenly starts to giggle insanely.  He takes off
his helmet, as a shock of GREEN HAIR is exposed!  He wipes his lips
clean which now become ruby red.  Cackling in glee, THE JOKER faces his
victims, his gaze suddenly becoming cruel and cold.

JOKER
One at a time, your money and your
jewels, and no one's head'll wind
up looking like the Commissioner's
watch, capisce?

KOP #3
Hey, boss!  Look!

The Joker turns.  Kop #3 and a PARTNER have set Gordon's huge birthday
cake on the floor, now wade through it, stomping up and down, kicking
the insides across the room.

KOP #3
We're doing the cake walk!

The Joker giggles, then shoots a satanically maniacal look at the
Guests who instantly begin stripping off their jewelry, taking out
wallets, etc. as more Kops pass by with a gunny sack.  The Joker walks
down the line, stopping to level a searching and curious gaze into the
eyes of:

Bruce Wayne, between Gordon and Silver, his face set, eyes steely,
staring at the Joker.  His jaw twitches.

Silver watches him, noticing the twitch.  She gives him a tiny,
sympathetic smile, then turns to face:

Kop #2, who has moved down the line to Silver.  He looks her up and
down hungrily as she stares back in defiance.  His fingers slowly reach
up to grip her necklace, then linger.

KOP #2
In your case, lady, I'd like to
rip the rest off and leave this on.

Suddenly:  BRUCE'S FIST FLASHES INTO FRAME!  Kop #2 is knocked backward
through the air as another Kop lunges at Bruce who grabs the gunny sack
filled with jewelry and bashes him in the face!  The Kop crumples to
the floor as Bruce wheels to face the Joker and sees:

The Joker, grinning cruelly, the barrel of his gun pressing up under
Silver's chin.  Her eyes are welded shut with fear.

JOKER
Now that was extremely bad manners,
Mr. Wayne.  Especially from someone...
(gestures)
...to the Manor born...
(giggles)
So why don't you rejoin the lady here,
or if you like...
(cocks gun; glowers)
I can send part of her over to you.

Bruce hesitates, then rejoins the line.  The Joker lowers his gun,
turns to stare at a painting on the wall as a Kop holds out the open
gunny sack to Gordon.

GORDON
(to Joker)
I'll see you rot in the gas chamber
for this.

The Joker smiles, ignoring him, looking at the portrait painting which
is of a distinguished older man.  He removes it from the wall.  An
indignant Alfred speaks up from farther down the line of Guests.

ALFRED
Be careful, you clot!  That portrait
goes back to Mr. Wayne's grandfather!

JOKER
Why?  Is there something wrong with
it?

The Joker cackles, punching the painting out of its frame.

CLOSE ON BRUCE AND SILVER

Bruce stares silently.  His jaw twitches with anger born of
humiliation.  Silver notices again.

SILVER
(whisper)
Look on the bright side.  You're
adorable when your jaw twitches.

BACK TO SCENE

The Joker crosses to Gordon with the empty picture frame.  Another Kop
points a camera as the Joker holds the frame up to encircle his and
Gordon's face.

JOKER
(giggling)
I've always wanted to frame a Police
Commissioner...

CLOSE ON JOKER'S AND GORDON'S FACES

Gordon shuts his eyes in disgrace.  The Joker howls with glee.

THE FLASHBULB STROBE WIPES THE SCEEN!

EXT. WAYNE MANOR - NIGHT

The Kops exit Wayne Manor with their loot, climb back into the paddy
wagon, roar out of the driveway.

INT. WAYNE MANOR - NIGHT

The terrified and disgruntled Guests head for the door as Bruce and
Silver look over at a devastated Gordon.

BRUCE
I'm afraid the tabloids are going
to have a field day with this, David.
Not to mention Rupert Thorne.

ALFRED
(joining them)
I tried calling the police.  The
phone line seems to have been cut.

GORDON
I'll report it myself, Alfred.
Right before I cut my throat.

He tries to check his watch, stares at an empty wrist, sighs, then
joins the stream of departing Guests as Bruce looks over at Silver
glumly.

BRUCE
Well.  Good-night.  I guess...

SILVER
(sudden grin)
Why don't be silly.  I've only just
arrived.

BRUCE
(smile)
Would you care to dance, Miss St. Cloud?

SILVER
(offering her arm)
You're as clairvoyant as you are
gallant, Mr. Wayne...

EXT. GOTHAM POLICE HEADQUARTERS - NIGHT

A crestfallen Gordon exits his car in front of Police Headquarters.

INT. POLICE HEADQUARTERS - NIGHT

Gordon walks slowly and dejectedly down the nearly deserted hallway.
As he passes one DETECTIVE'S cubicle, the sound of SNICKERING is HEARD
from inside.

Gordon stops defiantly.  The snickering instantly dies away.  Muttering
disgustedly, Gordon enters his office.

INT. GORDON'S OFFICE - NIGHT

The office is lit only be a small desk lamp.  Strung up behind the desk
is a crudely-made banner reading:  HAPPY BIRTHDAY TO OUT COMMISH - FROM
ALL YOUR BOYS IN BLUE.

Gordon shakes his head sadly, crosses to a cabinet, pours himself an
enormous glass of Scotch, then crosses with the bottle to the open
office window.  He takes a long swig, exhales, then slams the window
shut.

EXT. WAYNE MANOR - NIGHT

The Wayne Manor driveway is deserted under the moonlight.

INT. WAYNE MANOR - NIGHT

The band plays a soft, dreamy number as Bruce and Silver dance together
dreamily, locked in each other's arm, drifting silently through the
vast living room.

CLOSER ON THEM

Silver's eyes flutter open, then lock into his.

SILVER
Maybe you'd better take me home...

BRUCE
I am home...

SILVER
(soft murmur)
You see...I don't do anything on
the first date...

BRUCE
Don't be so hard on yourself...You're
doing just fine...

He draws her in more tightly as hey glide across the floor.

EXT. SILVER'S APARTMENT HOUSE - NIGHT

Bruce's Aston-Martin is parked in front of an unassuming apartment
house in middle-class Gotham.

INT. SILVER'S APARTMENT HOUSE - NIGHT

Bruce escorts Silver down the modest, clean hallway.

SILVER
Thank you for a totally unexpected
evening, Bruce.  I like surprises...

She stops at a door, inserts her key, turns, smiles.

SILVER (CONT'D)
Including you.

BRUCE
Oh?  How did...
(smile)
Rupert Thorne describe me?

SILVER
As a rather ineffectual playboy.
But pleasant enough in a harmless
sort of way.

BRUCE
Like an affable grasshopper bouncing
around in the middle of all you
hard-working ants...

SILVER
Something like that.

Bruce takes her hand gently, stares deeply into her eyes.

BRUCE
And you?  How would you describe me?

SILVER
(staring back)
I don't think you're harmless.  And
I don't think anyone who's looked
straight in your eyes could say so.

Bruce's jaw twitches involuntarily.  Silver grins.  He leans in, kisses
her lingeringly on the mouth.  They break.  He gazes into her
disoriented eyes.

BRUCE
Frightened?

SILVER
Terrified...but don't worry...
(soft smile)
As a kid they always had to drag me
off the roller coaster.

They kiss again, passionately.  She looks up, confused.

SILVER (CONT'D)
I sleep I'll get some think now...

She turns key, slips through the door, closing it again.

Bruce sigh, slumps back heavily against the wall, realizing a dilemma
he may never be able to solve.

EXT. GOTHAM SKYLINE - NIGHT

The yellow moon glows brightly over Gotham City.

INT. GORDON'S OFFICE - NIGHT

Gordon is slumped over his desk, mumbling to himself in a half-drunken
stupor.  The bottle of Scotch next to him has clearly been emptied.

Suddenly - a gust of cold wind ruffles his hair.  His eyes flutter,
then look over at the open office window.

GORDON
Thought I closed that Goddamn thing...

He staggers to the window, looks out sadly.

BATMAN'S VOICE
Whatever you do - don't jump.

Gordon whirls.  Batman looms up from a dark corner.

BATMAN (CONT'D)
We've been at odds, Commissioner,
and it's Gotham's loss.  My fight
isn't with you.  It's with the dis-
eased scum infesting this city.

Gordon backs up toward his desk, smiles nervously.

GORDON
Of course it is...

BATMAN
Criminals are a cowardly lot at heart.
But human garbage like the Joker is
taking over Gotham - in spite of
everything that you and other men of
good will can do about it.

GORDON
