,name,artists,acousticness,danceability,duration_ms,energy,instrumentalness,key,liveness,loudness,mode,speechiness,tempo,time_signature,valence,lyrics,annotations,nlp_lyrics,nlp_annotations,valence+nlp,mood
0,SUGAR,['BROCKHAMPTON'],0.449,0.453,204533,0.538,0.0,1,0.19,-8.212,1,0.0638,122.973,4,0.516,"[Chorus: Ryan Beatty]
Spendin' all my nights alone, waitin' for you to call me
You're the only one I want by my side when I fall asleep
Tell me what I'm waitin' for, tell me what I'm waitin' for
I know it's hard but we need each other
Know it's hard but we need each other

[Verse 1: Dom McLennon]
I move mountains on my own, don't need nobody help
Changed your mind when I changed my life, better start believin' in myself
And we all out lookin' for, lookin' for God so we never see it in ourself
Shit, divine intervention move in stealth
It's hard to tell what the prayer compelled
You can find me dancin' in between the raindrops
Tryna find a way to make the pain stop
Overtime, on the graveyard
Got a nigga feeling brainwashed
My instability's trademark
Copy-written in all my decisions
This is not supposed to be a way of livin'
Turned my temple down into a prison, shit

[Chorus: Ryan Beatty]
Spendin' all my nights alone, waitin' for you to call me
You're the only one I want by my side when I fall asleep
Tell me what I'm waitin' for, tell me what I'm waitin' for
I know it's hard but we need each other
Know it's hard but we need each other

[Verse 2: Matt Champion]
Yeah, back on Vincent with the braces on
Used to slide out the back without the neighbors knowin'
Pose for the picture with the pearly whites
Dead lens zoomin' in, catchin' all my strikes
Used to trade Jordan for some molly
And she gave me all I need for the night, forties suffice
Morally alright, but I need some advice
And I know that I'm actin' foolish
Chris would pick me up around noon-ish
Half a blunt, yeah, we coolin'
Twist it up, puttin' on OutKast
Hunnid, Texas heat, and yeah, we cruisin'

[Pre-Chorus: bearface]
But when I love you right, I love you right
All by yourself
But I'll make it bright, baby, I want you to know
I'ma be there for you, I'ma make you see that
I want you, I want you

[Chorus: Ryan Beatty]
Spendin' all my nights alone, waitin' for you to call me
You're the only one I want by my side when I fall asleep
Tell me what I'm waitin' for, tell me what I'm waitin' for
I know it's hard but we need each other
Know it's hard but we need each other

[Bridge: Kevin Abstract]
Back and forth
I'll take that if that's all you askin' for
With my legs up on the dashboard
Only thing in my pocket is my passport, pa-passport
Back and forth
I'll take that if that's all you askin' for
With my legs up on the dashboard
Only thing in my pocket is my passport, pa-passport
Back and forth
I'll take that if that's all you askin' for
With my legs up on the dashboard
Only thing in my pocket is my passport, pa-passport

[Outro: bearface]
So, do you love me, love me, love me?
Do you love me, love me, love me?
Do you love me, love me, love me?
Do you love me, love me? Oh
Do you love me, love me, love me?
Do you love me, love me, love me?
Do you love me, love me, love me?
Do you love me, love me? Oh","[('Changed your mind when I changed my life,', [['This could mean either one of two things\n\n\nIs that Dom was broken up with and he decided to change him self for the better after the relationship, and that made his Ex want to date him again\n\n\n\nor\n\n\nWhile in a relationship Dom changed something big within his life (maybe becoming famous or changing his main focus to making music) and that made his partner want to break up with him\n\n\n\neither way both scenarios are pretty similar']]), ('[Bridge: Kevin Abstract]', [['In a MTV interview,  Kevin talks about how his bridge and what he thinks about with Sugar is it’s a song about being in a relationship and not really knowing where it’s going, but being okay with that.\n\nWhat’s interesting is that fan’s also have conveyed this feeling when listening to Sugar. On this podcast fans convey that the bridge of Sugar reminds them of the same feeling of not knowing what they are doing and being okay with that.']]), ('[Verse 2: Matt Champion]', [['In an interview with MTV, Matt Champion talks about how the hook Ryan Beatty put down on this song reminds him of highschool.\n\nMatt grew up in Woodlands, Texas, a suburb outside of Houston. Matt, Kevin Abstract, Ameer Vann (now removed from the band), Merlyn Wood, and JOBA all met at Woodlands High School, but the band was formed through a Kanye fan page with all the other members.\n\nThis verse describes Matt’s high school experience in a nostalgic way.']]), ('Overtime, on the graveyard', [['The graveyard refers to “The Graveyard Shift” a phrase coined in the 1800’s but was brought back into modern popular culture from Stephen King’s short story of the same name.\n\nThe graveyard shift is typically considered between Midnight and 8 AM. Dom is stating in a play on words that his overworking deep into the late nights is gonna lead him to the graveyard or his death, as well as has feeling delusional, or brainwashed, as stated in the line following this.\n\nThis could be talking about his standard jobs before Brockhampton took off, or his and the group need to overwork themselves to the point of being considered as clocking in overtime, and as shown in the Saturation Documentary, the group would sometimes spend their time up until the early mornings giving the finishing touches on their albums the day before their release.']]), ('Only thing in my pocket is my passport, pa-passport', [['This isn’t the first time Kevin has referenced his passport, as he mentioned the item on their 2017 song “BLEACH”:\n\nI forgot my passport, for sure, all for a pretty sky\n\nHowever, he uses it in a different context this time. Whereas then Kevin’s passport was symbolic of him pursuing feelings over tangible objects, now it helps build a romantic scene. Kevin is going on a road trip with his partner, and all he needs is his passport to allow him access to wherever they find themselves.\n\nHe also referenced the document in his 2016 song “Empty,” in which he raps:\n\nI hate my yearbook photo\nI hate my passport, I hate my last name\nI hate everything it stands for\n\nIn this context, his passport contained information that could be used to arbitrarily define him. It was a symbol he used to express his distaste for a one-dimensional view of a person. Now, it seems he has come to terms with it and is okay with carrying it around.\n\nWhile having his passport now may be seen as a sign of maturity and growth, Kevin is still living care-free, not tied down by money or social media, as represented by objects typically found in pockets: wallets and phones.']]), ('Twist it up, puttin’ on OutKast', [['OutKast is a duo from Atlanta, made up of rap legends André 3000 and Big Boi. The group put out some of the most critically acclaimed hip-hop records of all time, such as September 2003’s Speakerboxxx / The Love Below and August 1996’s ATLiens, and was wildly successful until their hiatus in 2006.\n\nIn a June 2019 interview with GQ, BROCKHAMPTON co-founder Kevin Abstract said that the material from GINGER sounded like the iconic OutKast hit “Hey Ya!” The group’s 2018 track, “1999 WILDFIRE,” also drew many comparisons to another OutKast song, “The Love Below.”\n\nAdditionally, In an August 2019 interview with Sway’s Universe, Matt Champion said that OutKast was one of the first groups that he came across when he began listening to the genre.']])]",0.9993,0.9993,0.536,Sad
1,Yeah Right,['Joji'],0.624,0.672,174358,0.59,0.236,1,0.0991,-9.574,1,0.129,169.036,4,0.21,"[Intro]
I'ma fuck up my life
I'ma fuck up my life
I'ma fuck up my life
I'ma fuck up my life

[Verse 1]
I'ma fuck up my life
I'ma fuck up my life
We gon' party all night
She don't care if I die
Yeah, right, yeah, right
Yeah, I bet you won't cry
Yeah, I bet you won't try
But you know I don't mind
But you know I don't mind

[Pre-Chorus]
Yeah right, yeah right
Yeah right, yeah right
Yeah right, yeah right

[Chorus]
Yeah, you bet I know that she ain't
Never give a single fuck about me
Yeah, you bet she know that we ain't
Never gonna be together, I see
Yeah, you bet I go to see you when
I'm feeling like a drum without a beat
Yeah, you dance so good
And I think that's kinda neat

[Verse 2]
What you know about love?
What you know about life?
What you know about blood?
Bitch, you ain't even my type
Yeah right, yeah right
Yeah, you know I feel right
Yeah, you living right now
You don't ever pick sides
Yeah right, yeah right
I'm overthinking my pride
But I don't gotta look nice
She just feelin' my ice
(She just feelin' my-)

[Chorus]
Yeah, you bet I know that she ain't
Never give a single fuck about me
Yeah, you bet she know that we ain't
Never gonna be together, I see
Yeah, you bet I go to see you when
I'm feeling like a drum without a beat
Yeah, you dance so good
And I think that's kinda neat","[('What you know about love?', [['This is like the character of the song starting to realise that the girl he is dancing with is superficial and not here for the long term. She doesn’t care about him so how could she know about feelings such as love?']]), ('Yeah right, yeah right\n Yeah, you know I feel right\n Yeah, you living right now\n You don’t ever pick sides', [['Someone once told me a long time ago that like, “You’re not loyal to shit. You don’t have any sides. You don’t stand on any side on anything, you just skate the line.” That was because at that time I didn’t care about anything. I was just living a very wake up, blah blah blah, and substance abuse, whatever. Once you’re in a numbed state, you just don’t pick sides. It’s like, why would you even pick sides when you can just be on your own and do your own thing.']]), ('What you know about blood?\n Bitch, you ain’t even my type', [['What do you know about family and what do you know about true values of friendship? Because if you’re here with me, surely you can’t have great values. And by me, I mean, not me but the character of the song.\n\n“Bitch, you ain’t even my type”, is a moment of realization. It’s like, I know that it’s like you’re not even my type, but like I said, I don’t mind.']]), ('What you know about life?', [['I mean, the way I see life is like, no-one’s special. You’re not born special, if you’re lucky you’re given a certain set of skills and a certain set of resources and you run with them, and then everyone dies. So as long as they know that, and they’re not thinking in a God’s plan sort of way, ‘cause it’s like, “Why is God only looking out for one person?” That’s stupid, it’s not in your favor all the time. So just stuff like that, that’s what I would assume, like do you know what’s happening right now? Do you understand that it’s flesh? I don’t know.']]), ('Yeah, you bet I go to see you when\n I’m feeling like a drum without a beat\n Yeah, you dance so good\n And I think that’s kinda neat', [['You don’t mind this whole thing going on, you gotta keep in mind of that. So when you’re just lonely, if she’s available, as with like a filthy old man, you’ll still go to see her when you’re feeling like a drum without a beat. Even though you know that you’re giving out, and doing all this and that.']]), ('Yeah, you bet she know that we ain’t\n Never gonna be together, I see', [['It’s very obvious that she does not see a future, or she doesn’t want to be with me in any sort of way, in any other given circumstance.']]), ('Yeah, you bet I know that she ain’t\n Never give a single fuck about me', [['You definitely know when someone doesn’t give a fuck about you when they’re not checking you at all. I feel like if they’re very indifferent, but they’re just like, to everything you say … you’re like, “Is this a good thing, is this a bad thing?” They’re like, “Yeah, yeah. Whatever.” Oftentimes, people that don’t care, there’s different types but in this sense, if we’re talking about these lyrics, I would think the girl is literally just using this guy. I know I said there are no pronouns, but there totally are, I’m sorry.\n\nI would say they don’t give a fuck when they become indifferent. Because if they’re mad, and they’re still interacting with you, then they still care, obviously. But if they’re not interacting at all, and they’re just kind of going along with everything you do, then if you’re not rich, then they’re just indifferent. If you do have something to offer to them, they would just stick around but still be indifferent.']]), ('Yeah, right, yeah, right\n Yeah, I bet you won’t cry\n Yeah, I bet you won’t try\n But you know I don’t mind\n But you know I don’t mind', [['This person doesn’t mind because the self-hatred has already been established. This is a person that’s way past self-hatred, someone who’s already very honest with themselves, and they’re like … look, it could be just a person and their significant other in a room together, or just the thought of them being in a relationship or something, and it’s like, “Listen, I know I’m not getting any younger. This is this and that.” You hit an age, you’re like, yeah, well I mean this is like, I got this, this is great for now, if it doesn’t turn out to be great it’s whatever, but this is what I have now and I don’t think I’m gonna find anything much better so I’m gonna stick to this and I don’t mind. Because it’s not destructive, it’s not productive, but it’s not destructive.\n\nThat’s how a lot of people get stuck, I feel like, in relationships and also just life in general. They’re just getting comfortable, and this person who’s singing this song doesn’t mind the lifestyle of just, you know … being with girls with the bottles and stuff, that’s cool too. I’m like that, every now and then maybe.']]), ('We gon’ party all night\n She don’t care if I die', [[""For “She don’t care if I die”, it’s like, “I'ma fuck up my life, and we’re gonna party all night.” So I’ve introduced that, we’re partying and we’re having a good time, but this chick, once again adding to the fucking song topic, she doesn’t care if I die. I could fall over in the club right now and have a heart attack, and you’d probably run or something. Or not, who am I to judge? But I wouldn’t trust you as a hospital contact or anything. I think I'ma stick to … yeah. Yeah, someone else. But you know, that’s still like, she doesn’t care if I die, I’m dancing with this chick or I’m with this chick, and she doesn’t care if I die.""]]), ('I’ma fuck up my life\n I’ma fuck up my life\n I’ma fuck up my life\n I’ma fuck up my life', [[""The way I see it, is this person is dancing or at a location or something, and it’s all momentary. It’s like, time stops, and he’s like, “I'ma fuck up my life.” Or it’s the act of being in a function or being with a girl and you’re just thinking like, “If I stay with this, if I keep doing this, I'ma fuck up my life.” It’s that kind of brutal self-honesty that I thought it’d be nice to open up the song with. It’s like, this is not great, but I’m still doing it because what other option do I have? Which I see a lot of men get into situations like that.""]])]",0.9895,0.9895,0.2298,Sad
2,The Loser,['Verzache'],0.485,0.748,131587,0.297,0.27,1,0.138,-10.613,1,0.132,123.983,4,0.114,"[Verse]
Started out with peanuts, young street dreamer
Feeling like Ace Boogie when he first quit the cleaners
Almost shocked the world, Muhammad Ali
I’m back stabbing, Calvin ass niggas tryna team up
Back watching my nigga because I’m watching for niggas
Who wanna stop me my nigga but trust me I’mma get richer
By any means, like macking with that thing in that picture
I ain't ringing like a iPhone, niggas wanna leave me cause
When you get money, trouble tend to come your way
If you play, raise my gun like my son in your face
I bust it like a nut, made me cum on your face
I go off like a bomb, think Saddam in this place
A lot of niggas in the way, still in a turtle race
But you know it ain’t no fun when the rabbit got the cake
I go hard like a pallet in yo place
And I ain’t spraying like Proactive in your face, you niggas at me to the streets
I can’t believe niggas believe niggas
Bet, you could check my background
Yea, I was gone for a minute but I’m back now
And you little niggas, summer’s over, fallback now
I done fell down a couple times, crawl back now
Hoes ain’t used to answer for me, now they call back now
I ain’t used to be shit, they think I’m all that now
Niggas hollering beef shit back to me, y'all on cow  worse
Yea, and these is words of a real nigga
No matter where, hand you a Dolce got a deal with it
And how I feel is how I feel, there’s no feel niggas
Cause fake niggas paralyze real niggas
Back when I was little loved to idolize real niggas
And see how much it says really do kill niggas
They ain’t gon' feel you til they kill you
I’m top five dead or alive,  one of the realest
Just the ordinary life of a G
I can’t believe these niggas want stripes off of me
Niggas I grew up with, I can’t even fuck with
He can’t look you in the eyes, then a nigga suspect
That’s the reason I can’t trust shit
But my vision colorful as TrukFit
I could see the future
I could see the winners and the loser
Copping Versace, I feel like Medusa
Snakes around my head, snakes around my bed
Snakes all in the yard, damn, gotta cut the grass
Niggas I give my last, they don’t even wanna see me last
Take the good with the bad but damn this shit bad
Get money, don’t get mad
I said get money, don’t get married
Only wife of mine just this life of crime
When I started fronting with Duck I almost got fired
I remember hearing shots fired in the hospital dog
Said he thrown apart, can’t recognize
I’m up nine, mane backin' down
It’s trap life til my casket down
This my city, you can ask around
And if I’m lying in that case, a fish can drown
My god, we ain’t no motherfuckin biscuit town
Yall can keep all that bullshit, just don’t forget the crown
King shit","[('Niggas I give my last, they don’t even wanna see me last', [['People that Doe B would give his last to, doesn’t even want to see him last. Or even doing good.']]), ('I’m top five dead or alive,  one of the realest', [['He’s saying dead or alive, he should be in your top 5 best rappers list. Because he is a good rapper & is one of the realest to handle a mic.']]), ('Niggas hollering beef shit back to me, y’all on cow  worse', [['The line is supposed to be “Niggas hollering beef shit but to me all of em cow-ards”. Meaning that dudes are always talking about beefing but when it comes down to it Doe B thinks they’re bitches.']]), ('I ain’t used to be shit, they think I’m all that now', [['Back when Doe B was broke with no money, females used to say he wasn’t shit & played him. Now that he is rich & famous they think he’s all that.']]), ('Hoes ain’t used to answer for me, now they call back now', [['Females used to screen his phone calls but now since he is famous & rich, they won’t only answer but they call back when he calls.']]), ('By any means, like macking with that thing in that picture', [['The line is supposed to be “By any means, like Malcolm with that thing in that picture”. “By any means” is a popular catchphrase that Malcolm X used to let everyone know that he believed in self-defense. Meaning he would protect hisself by any means, no matter if that means harming another human being.. so be it. Doe B is referring to a infamous picture of Malcolm X holding a AK-47 looking out a window. By the line “By any means, like Malcolm with that thing in that picture”, Doe B is saying he agrees with Malcolm X’s logic and will shoot and kill someone about his personal safety.']]), ('Almost shocked the world, Muhammad Ali', [['Muhammad Ali was one of the greatest heavyweight boxers in the world, often shocking the world with his speed and strength. Doe’s bars are often good enough to shock the world in the same way Ali did.']]), ('Snakes all in the yard, damn, gotta cut the grass', [['Doe B continues the snake references. He’s saying that he’s surrounded by snakes, which is another word used to mean snitches and backstabbers.\n\n“Snake in the grass” is an expression that refers to a sneaky, conniving person.\n\nThe snakes Doe B is surrounded with keep themselves hidden so well that Doe B needs to metaphorically “cut the grass” to see who’s fake and who’s real.']]), ('A lot of niggas in the way, still in a turtle race\n But you know it ain’t no fun when the rabbit got the cake', [['A lot of niggas in the way, still in a turtle race\n\nIn this line, Doe B uses “turtle race” to mean the same thing as “rat race”, an intensely competitive struggle for success. Doe B is in the struggle with a lot of competitors in his way.\n\nBut you know it ain’t no fun when the rabbit got the cake\n\nThis line refers to the Aesop’s fable called The Tortoise and the Hare, in which an overly confident hare (similar to a rabbit) challenges a slow tortoise (similar to a turtle) to a race. The race starts and the hare speeds past the tortoise and eventually decides he’s far enough along to warrant taking a nap, leading to the turtle slowly but surely beating the hare.\n\nDoe B says that he isn’t happy when the metaphorical rabbit (who is usually seen as the villain of the Fable) achieves success–or takes the “cake”–instead of him.']]), ('But my vision colorful as TrukFit', [['Doe B’s compares his vivid vision for the future to TrukFit, which is Lil Wayne’s clothing brand, because of its colorful products.']])]",-0.999,-0.999,0.094,Sad
3,Pluto Projector,['Rex Orange County'],0.707,0.379,267520,0.219,0.000691,5,0.118,-11.196,1,0.0307,79.786,4,0.188,"[Verse 1]
The great protector
Is that what I'm supposed to be?
What if all this counts for nothing
Everything I thought I'd be?
What if by the time I realize
It's too far behind to see?
Seventy-mil projector
I can show you everything, yeah
And we're on our way to glory
Where the show won't ever end
And the encore lasts forever
And it's time we're due to spend

[Verse 2]
Spending the years together
Growing older every day (Every day)
I feel at home when I'm around you
And I'll gladly say again
I hope the encore lasts forever
Now there's time for us to spend
And it's sublime with you, my friend
This right here still feels like a honeymoon
When you say my name, nothing's changed
I'm still a boy inside my thoughts
Am I meant to understand my faults?

[Chorus]
I don't think so
I don't think I'm meant to understand myself
Maybe you do
And that's good for you
Maybe in time
Maybe one day
I'll do the same
(I'll do the same
I'll do the same
I'll do the same)

[Bridge]
I'll do the same as you
I'll try and hold it up
Soon I hope
Or as soon as I'm old enough
(Old enough to understand
Old enough to understand)

[Outro]
Stay forever, you know more than anyone (Yeah, whoa)
And it's you that knows my darkness
And you know my bedroom needs
You could blast me and my secrets
But there's probably just no need","[('I’m still a boy inside my thoughts\n Am I meant to understand my faults?', [['In this line, Alex is coming to terms with being a young adult and the impact that can have on the relationships in his life. Alex’s career pushed him into stardom during his transition into adulthood, which maybe meant that he didn’t have much alone time to reflect on the changes in his own life.\n\nHe understands that he is supposed to be responsible for his actions but his thoughts and biases from his childhood sometimes make it difficult for him to accept that. He asks the question, ‘Am I meant to understand my faults?’ in the hopes that maybe he isn’t the only one with these immature tendencies but acknowledges that it’s something that he needs to work on as he grows as a person, as he doesn’t want it to affect his relationship with his girlfriend, Thea.']]), ('Spending the years together\n Growing older every day (Every day)\n I feel at home when I’m around you\n And I’ll gladly say again\n I hope the encore lasts forever', [['Alexander and his girlfriend Thea have been together for almost 4 years now, their anniversary is on October 31st. He’s saying that he feels safe around her, and he’s hoping that they’ll last forever']]), ('Seventy-mil projector\n I can show you everything,', [['Rex refers here to a 70-millimeter film projector. 70mm is a high-resolution film format that uses frames that are larger and wider in aspect ratio than the standard 35mm. From an audience’s standpoint, the images on-screen are much more crisp, uniform, and bright. Over the past few years, many big-ticket movies such as Interstellar (2014), Dunkirk (2017), and Once Upon a Time in Hollywood (2019) have used the format.\n\nIn context, Rex is saying that he has much more to offer to this person – who is likely his longtime girlfriend, Thea – than anyone else.']])]",0.9681,0.9681,0.2074,Sad
4,I Think There's Something You Should Know,['The 1975'],0.0164,0.624,240986,0.787,0.317,5,0.194,-9.481,1,0.0601,123.475,4,0.136,"[Verse 1]
I think there's something you should know
I don't feel like myself, I'm not gonna lie (Lie)
How would you know? It doesn't show
I think there's something you should know (Know, know)
I think there's something you should know
I’m feeling like someone, like somebody else
I don’t feel myself, it could be my health
I'd like to meet myself and swap clothes
I think there's something you should know

[Refrain]
(I think there's something)
